{
  "schema_version": 1,
  "task_id": "AIC-0009",
  "title": "SECURITY.md: canal privado de vulnerabilidade (texto). A habilitacao do canal e passo do coordenador",
  "state": "ASSIGNED",
  "owner": "codex",
  "role": "implement",
  "assigned_by": "human",
  "created_at": "2026-09-21T23:18:46Z",
  "updated_at": "2026-09-21T23:18:46Z",
  "branch": "codex/AIC-0009-security",
  "worktree": "../wt-codex",
  "base_commit": null,
  "scope": {
    "allowed_paths": [
      "SECURITY.md"
    ],
    "forbidden_paths": [
      ".ai/tasks/",
      ".ai/schemas/",
      ".ai/examples/",
      "LICENSE",
      "CONTRIBUTING.md",
      ".claude/",
      ".agents/",
      "scripts/",
      "tests/",
      ".github/",
      "docs/",
      "README.md"
    ]
  },
  "acceptance": [
    "SECURITY.md remove a frase 'A future release should add...' e manda relatar por 'Security > Report a vulnerability' do GitHub, sem inventar e-mail nem link",
    "Declara o que e vulneravel de fato (escrita fora do repo, symlink, escape de caminho, condicao de corrida no lock, handoff tratado como ordem) e o que nao e",
    "Declara que so a main recebe correcao",
    "O handoff registra, em risks, que o canal so existe depois que o coordenador roda: gh api -X PUT repos/LucasCerattoRS/ai-coop/private-vulnerability-reporting",
    "A entrega e um handoff ESCRITO PELO CODEX com $ai-handoff / scripts/handoff.sh, validado com scripts/validate-handoff.py, em commit separado do codigo",
    "Suites tests/test_handoff.sh, tests/test_skills.sh e tests/test_doctor.sh continuam verdes; nenhum caminho de forbidden_paths tocado",
    "Autoria LuKas <Lukelucanolightknowledge@gmail.com>, sem trailers de coautoria; sem merge, sem push"
  ],
  "handoffs": [],
  "notes": "Codex nao tem autoridade para mudar configuracao do repositorio remoto: essa parte e do coordenador. Revisao independente do Claude adiada ate o reset de creditos; sem ela o coordenador le o handoff e decide o merge."
}
