{
  "schema_version": 1,
  "task_id": "AIC-0017",
  "title": "Revisao somente leitura da entrega da AIC-0013 (commit ea4db6f) pelo Claude",
  "state": "ACCEPTED",
  "owner": "claude",
  "role": "review",
  "assigned_by": "human",
  "created_at": "2026-09-22T21:15:00Z",
  "updated_at": "2026-09-22T21:30:00Z",
  "branch": "claude/AIC-0017-review",
  "worktree": "../wt-claude",
  "base_commit": null,
  "scope": {
    "allowed_paths": [
      "-nenhuma escrita: revisao somente leitura"
    ],
    "forbidden_paths": [
      "docs/",
      "scripts/",
      "tests/",
      ".claude/",
      ".agents/",
      "AGENTS.md"
    ]
  },
  "acceptance": [
    "Mira o commit exato ea4db6f (delivery da AIC-0013), em copia isolada, sem editar wt-codex",
    "Cada criterio de aceite da AIC-0013 conferido por execucao real, incluindo o comportamento de fast-forward",
    "Veredito: ACEITAR, ACEITAR_COM_RESSALVAS ou MUDANCAS_NECESSARIAS"
  ],
  "handoffs": [
    "0001-claude.json"
  ],
  "notes": "Revisao aceita e integrada pelo coordenador em 22/09. Veredito do handoff 0001: ACEITAR. A tarefa e o diretorio proprios evitam colisao de sequencia com AIC-0013."
}
