{
  "schema_version": 1,
  "task_id": "AIC-0019",
  "title": "Revisao somente leitura da entrega da AIC-0011 (commit b1132ba) pelo Claude",
  "state": "ACCEPTED",
  "owner": "claude",
  "role": "review",
  "assigned_by": "human",
  "created_at": "2026-09-22T21:03:00Z",
  "updated_at": "2026-09-22T21:30:00Z",
  "branch": "claude/AIC-0019-review",
  "worktree": "../wt-claude",
  "base_commit": null,
  "scope": {
    "allowed_paths": [
      "-nenhuma escrita: revisao somente leitura"
    ],
    "forbidden_paths": [
      "docs/",
      "scripts/",
      "tests/",
      ".claude/",
      ".agents/",
      "AGENTS.md"
    ]
  },
  "acceptance": [
    "Mira o commit exato b1132ba (delivery da AIC-0011), em copia isolada, sem editar wt-codex",
    "Cada criterio de aceite da AIC-0011 conferido por execucao real, incluindo teste de mutante nos dois ramos fechados (git ausente, symlink)",
    "Veredito: ACEITAR, ACEITAR_COM_RESSALVAS ou MUDANCAS_NECESSARIAS"
  ],
  "handoffs": [
    "0001-claude.json"
  ],
  "notes": "Revisao aceita e integrada pelo coordenador em 22/09 sem nova rodada. Veredito do handoff 0001: ACEITAR_COM_RESSALVAS; a referencia cruzada documental foi classificada como nao bloqueante."
}
