{
  "schema_version": 1,
  "task_id": "AIC-0015",
  "title": "Revisao somente leitura da entrega da AIC-0014 (commit 1d8da9b) pelo Claude",
  "state": "HANDED_OFF",
  "owner": "claude",
  "role": "review",
  "assigned_by": "human",
  "created_at": "2026-09-22T21:20:00Z",
  "updated_at": "2026-09-22T21:20:00Z",
  "branch": "claude/AIC-0015-review",
  "worktree": "../wt-claude",
  "base_commit": null,
  "scope": {
    "allowed_paths": [
      "-nenhuma escrita: revisao somente leitura"
    ],
    "forbidden_paths": [
      "docs/",
      "scripts/",
      "tests/",
      ".claude/",
      ".agents/",
      "AGENTS.md"
    ]
  },
  "acceptance": [
    "Mira o commit exato 1d8da9b (delivery da AIC-0014), em copia isolada, sem editar wt-codex",
    "Cada criterio de aceite da AIC-0014 conferido por execucao real, incluindo ausencia de dependencia externa",
    "Veredito: ACEITAR, ACEITAR_COM_RESSALVAS ou MUDANCAS_NECESSARIAS"
  ],
  "handoffs": [
    "0001-claude.json"
  ],
  "notes": "Tarefa criada pelo Claude na propria branch (nao em main), por instrucao explicita do coordenador em 22/09. Primeira tentativa de revisao (fork em background) desviou para um relato de status geral em vez do proprio veredito; esta revisao foi refeita diretamente pelo Claude na sessao principal. Veredito do handoff 0001: ACEITAR. Fica pendente de leitura e merge do coordenador."
}
