{
  "schema_version": 1,
  "task_id": "AIC-0006",
  "title": "handoff.sh: registrar o commit revisado em handoffs de review (fecha o ponto aberto do delivery_commit = HEAD)",
  "state": "HANDED_OFF",
  "owner": "codex",
  "role": "implement",
  "assigned_by": "human",
  "created_at": "2026-09-21T22:41:05Z",
  "updated_at": "2026-09-21T22:50:27Z",
  "branch": "codex/AIC-0006-review-arg",
  "worktree": "../wt-codex",
  "base_commit": "cf71f31aaf509330ea4d945442bbfed43d23457c",
  "scope": {
    "allowed_paths": [
      "scripts/handoff.sh",
      "tests/test_handoff.sh",
      "docs/AI-HANDOFF.md",
      "docs/SPEC-v0.1.md"
    ],
    "forbidden_paths": [
      "scripts/validate-handoff.py",
      "scripts/ai-coop-doctor.sh",
      ".ai/schemas/",
      ".ai/tasks/",
      ".ai/examples/",
      ".claude/",
      ".agents/",
      "AGENTS.md",
      "tests/test_doctor.sh",
      "tests/test_skills.sh",
      "docs/DOCTOR-CONTRACT.md",
      "docs/PARITY.md",
      "docs/ACCEPTANCE-FIRST-CYCLE.md",
      "ESTADO.md"
    ]
  },
  "acceptance": [
    "scripts/handoff.sh aceita um quinto argumento opcional REVIEWED_COMMIT. Com kind=review ele passa a ser OBRIGATORIO: review sem ele sai 2 e nao escreve nada",
    "kind diferente de review com quinto argumento sai 2",
    "REVIEWED_COMMIT precisa resolver para um commit existente (git rev-parse --verify REF^{commit}); o handoff grava o SHA completo de 40 caracteres, mesmo que o argumento seja abreviado ou um nome de branch. Inexistente sai 1 e nao escreve nada",
    "Em review, delivery_commit = commit revisado e base_commit = git merge-base main <commit revisado>; nos demais kinds nada muda (HEAD e merge-base main HEAD)",
    "tests/test_handoff.sh cobre cada caso acima e continua sem framework. Os testes existentes que geram review com 4 argumentos sao atualizados, nao apagados",
    "docs/SPEC-v0.1.md secao 9 e o passo 5 de docs/AI-HANDOFF.md descrevem o novo uso; o ponto aberto correspondente em AI-HANDOFF.md sai. Edicao minima: so o que mudou",
    "Nenhum arquivo em forbidden_paths tocado; tests/test_skills.sh, tests/test_doctor.sh e a suite do handoff continuam verdes",
    "A entrega e registrada por handoff ESCRITO PELO PROPRIO CODEX com scripts/handoff.sh e validado com scripts/validate-handoff.py: nao pode ser transcricao do Claude",
    "Todo commit com autoria LuKas <Lukelucanolightknowledge@gmail.com>, sem trailers de coautoria"
  ],
  "handoffs": [
    "0001-codex.json"
  ],
  "notes": "Entregue pelo Codex em 3a0ba8c com handoff escrito por ele (79999ee), na branch codex/AIC-0006-review-arg, sem merge. Revisao do Claude (AIC-0007): ACEITAR_COM_RESSALVAS. Codigo correto; o teste nao protege base_commit em review. Uma rodada de correcao pendente."
}
