{
  "schema_version": 1,
  "task_id": "AIC-0020",
  "title": "Revisao somente leitura da entrega da AIC-0012 (commit 1c55400) pelo Claude",
  "state": "HANDED_OFF",
  "owner": "claude",
  "role": "review",
  "assigned_by": "human",
  "created_at": "2026-09-22T20:58:03Z",
  "updated_at": "2026-09-22T20:58:03Z",
  "branch": "claude/AIC-0020-review",
  "worktree": "../wt-claude",
  "base_commit": null,
  "scope": {
    "allowed_paths": [
      "-nenhuma escrita: revisao somente leitura"
    ],
    "forbidden_paths": [
      "docs/",
      "scripts/",
      "tests/",
      ".claude/",
      ".agents/",
      "AGENTS.md"
    ]
  },
  "acceptance": [
    "Mira o commit exato 1c55400 (delivery da AIC-0012), em copia isolada (git worktree --detach), sem editar wt-codex",
    "Cada criterio de aceite da AIC-0012 conferido por execucao real, nao por leitura do handoff",
    "Veredito: ACEITAR, ACEITAR_COM_RESSALVAS ou MUDANCAS_NECESSARIAS"
  ],
  "handoffs": [
    "0001-claude.json"
  ],
  "notes": "Tarefa criada pelo Claude na propria branch (nao em main), por instrucao explicita do coordenador em 22/09 para a rodada de revisao das 6 entregas do Codex; padrao AIC-0007. Veredito do handoff 0001: ACEITAR, sem achados. Fica pendente de leitura e merge do coordenador."
}
