{
  "schema_version": 1,
  "task_id": "AIC-0002",
  "title": "Trilha B — superficie operacional: contrato do doctor, paridade publico/privado e criterios de aceite do primeiro ciclo",
  "state": "ACCEPTED",
  "owner": "codex",
  "role": "implement",
  "assigned_by": "human",
  "created_at": "2026-09-21T00:00:00Z",
  "updated_at": "2026-09-21T22:09:14Z",
  "branch": "codex/AIC-0002-operacional",
  "worktree": "../wt-codex",
  "base_commit": "1de57627913a2a28b40260a5ab77be0c72ec6b40",
  "scope": {
    "allowed_paths": [
      "scripts/ai-coop-doctor.sh",
      "docs/DOCTOR-CONTRACT.md",
      "docs/PARITY.md",
      "docs/ACCEPTANCE-FIRST-CYCLE.md",
      "tests/test_doctor.sh"
    ],
    "forbidden_paths": [
      "docs/SPEC-v0.1.md",
      ".ai/schemas/",
      ".ai/examples/",
      ".ai/tasks/",
      "scripts/handoff.sh",
      "scripts/new-handoff.sh",
      "scripts/validate-handoff.py",
      "tests/test_handoff.sh",
      ".agents/",
      ".claude/"
    ]
  },
  "acceptance": [
    "DOCTOR-CONTRACT.md declara escopo, o que o doctor NAO garante, e a tabela completa de codigos de saida",
    "ai-coop-doctor.sh implementa esses codigos: 0 saudavel, 1 degradado, 2 uso incorreto, 3 fora de repositorio git, 4 layout .ai ausente ou invalido",
    "o doctor nunca sai com 0 quando um requisito declarado obrigatorio esta ausente, e nao engole falha de comando git",
    "PARITY.md define uma unica fonte de verdade operacional entre a arvore publica e a privada e como a divergencia e detectada",
    "ACCEPTANCE-FIRST-CYCLE.md define criterios objetivos de aceite do primeiro ciclo Claude -> Codex -> Claude, limitado a uma rodada de revisao e uma de correcao",
    "tests/test_doctor.sh roda sem framework e verifica cada codigo de saida",
    "nenhum arquivo em forbidden_paths e tocado"
  ],
  "handoffs": [
    "0001-codex.json",
    "0002-claude.json"
  ],
  "notes": "Entregue em 92fc413, revisada pelo Claude: ACEITAR_COM_RESSALVAS (3 achados low, nenhum bloqueia). Mergeada em main pelo coordenador. Handoffs de AIC-0002 sao transcricoes do texto reportado pelo Codex e da revisao do Claude."
}
