{
  "schema_version": 1,
  "task_id": "AIC-0024",
  "title": "Revisao independente da AIC-0023 sobre 9e37a8d",
  "state": "ASSIGNED",
  "owner": "codex",
  "role": "review",
  "assigned_by": "human",
  "created_at": "2026-09-28T01:01:36Z",
  "updated_at": "2026-09-28T01:01:36Z",
  "branch": "codex/AIC-0024-review",
  "worktree": "../wt-codex",
  "base_commit": null,
  "scope": {
    "allowed_paths": [
      ".ai/handoffs/AIC-0024/"
    ],
    "forbidden_paths": [
      ".ai/tasks/",
      "o worktree de claude (ler so por git show 9e37a8d:<caminho>)"
    ]
  },
  "acceptance": [
    "Le o handoff AIC-0023-0001 (branch claude/AIC-0023-atritos) e revisa o commit 9e37a8ddff7a76dae712e2ce2b14460dc5bbea7f, nunca o nome da branch",
    "Confere os criterios de aceite da AIC-0023 e os riscos declarados no handoff",
    "Parecer em handoff kind=review: scripts/handoff.sh AIC-0024 codex claude review 9e37a8ddff7a76dae712e2ce2b14460dc5bbea7f, validado e commitado na propria branch",
    "Sem editar o trabalho revisado; achados viram correcao do autor"
  ],
  "handoffs": [],
  "notes": "Gerada por scripts/new-review-task.py a partir de AIC-0023-0001."
}
