{
  "schema_version": 1,
  "task_id": "AIC-0008",
  "title": "CI: GitHub Actions rodando as suites e um validador JSON Schema independente",
  "state": "ACCEPTED",
  "owner": "codex",
  "role": "implement",
  "assigned_by": "human",
  "created_at": "2026-09-21T23:18:46Z",
  "updated_at": "2026-09-22T21:30:00Z",
  "branch": "codex/AIC-0008-ci",
  "worktree": "../wt-codex",
  "base_commit": null,
  "scope": {
    "allowed_paths": [
      ".github/workflows/",
      "tests/test_schema_conformance.py",
      "README.md"
    ],
    "forbidden_paths": [
      ".ai/tasks/",
      ".ai/schemas/",
      ".ai/examples/",
      "LICENSE",
      "CONTRIBUTING.md",
      ".claude/",
      ".agents/",
      "scripts/",
      "docs/",
      "SECURITY.md",
      "tests/test_handoff.sh",
      "tests/test_skills.sh",
      "tests/test_doctor.sh"
    ]
  },
  "acceptance": [
    "Workflow roda as 3 suites em push e pull_request; permissions: contents: read; sem segredos; nunca pull_request_target; acoes pinadas",
    "O job configura git user.name/user.email (os testes criam commits) e instala python3 e jsonschema",
    "tests/test_schema_conformance.py valida .ai/examples/ e todos os .ai/handoffs/**/*.json contra handoff.schema.json com a biblioteca jsonschema, e .ai/tasks/*.json contra task.schema.json. Fecha o risco 'schema e validador sao duas implementacoes'; divergencias reais encontradas viram achado no handoff, nao sao escondidas",
    "Prova de que o CI falha: o Codex roda localmente exatamente os comandos do workflow num clone limpo, uma vez verde e uma vez com um teste quebrado de proposito (exit != 0). A prova no GitHub e passo do coordenador: empurrar a branch e ver o job",
    "README ganha o badge do workflow",
    "A entrega e um handoff ESCRITO PELO CODEX com $ai-handoff / scripts/handoff.sh, validado com scripts/validate-handoff.py, em commit separado do codigo",
    "Suites tests/test_handoff.sh, tests/test_skills.sh e tests/test_doctor.sh continuam verdes; nenhum caminho de forbidden_paths tocado",
    "Autoria LuKas <Lukelucanolightknowledge@gmail.com>, sem trailers de coautoria; sem merge, sem push"
  ],
  "handoffs": [
    "0001-codex.json"
  ],
  "notes": "Entrega 5cc5f2b, handoff 0001-codex. Revisao independente AIC-0016: ACEITAR. Aceita e integrada pelo coordenador em 22/09; a observacao do job no GitHub fica registrada pela publicacao."
}
