{
  "schema_version": 1,
  "task_id": "AIC-0016",
  "title": "Revisao somente leitura da entrega da AIC-0008 (commit 5cc5f2b) pelo Claude",
  "state": "ASSIGNED",
  "owner": "claude",
  "role": "review",
  "assigned_by": "human",
  "created_at": "2026-09-22T20:56:27Z",
  "updated_at": "2026-09-22T20:56:27Z",
  "branch": "claude/AIC-0016-review",
  "worktree": "../wt-claude",
  "base_commit": null,
  "scope": {
    "allowed_paths": [
      "-nenhuma escrita: revisao somente leitura"
    ],
    "forbidden_paths": [
      "docs/",
      "scripts/",
      "tests/",
      ".claude/",
      ".agents/",
      "AGENTS.md"
    ]
  },
  "acceptance": [
    "Mira o commit exato 5cc5f2b (delivery da AIC-0008), em copia isolada (git worktree --detach), sem editar wt-codex",
    "Cada criterio de aceite da AIC-0008 conferido por execucao real, nao por leitura do handoff",
    "Veredito: ACEITAR, ACEITAR_COM_RESSALVAS ou MUDANCAS_NECESSARIAS"
  ],
  "handoffs": [],
  "notes": "Tarefa criada pelo Claude na propria branch (nao em main), por instrucao explicita do coordenador em 22/09 para a rodada de revisao das 6 entregas do Codex; padrao AIC-0007 (revisar tem tarefa e diretorio de handoff proprios). Fica pendente de leitura e merge do coordenador."
}
