{
  "schema_version": 1,
  "task_id": "AIC-0001",
  "title": "Trilha A — protocolo canonico: especificacao v0.1, schema de handoff e criacao segura de handoff",
  "state": "ACCEPTED",
  "owner": "claude",
  "role": "implement",
  "assigned_by": "human",
  "created_at": "2026-09-21T00:00:00Z",
  "updated_at": "2026-09-21T22:09:14Z",
  "branch": "claude/AIC-0001-protocolo",
  "worktree": "../wt-claude",
  "base_commit": "bdef1a7a0f2e1b760ca490fb14e8eda2434ec7db",
  "scope": {
    "allowed_paths": [
      "docs/SPEC-v0.1.md",
      ".ai/schemas/handoff.schema.json",
      ".ai/examples/",
      "scripts/handoff.sh",
      "scripts/validate-handoff.py",
      "tests/test_handoff.sh"
    ],
    "forbidden_paths": [
      "scripts/ai-coop-doctor.sh",
      "docs/DOCTOR-CONTRACT.md",
      "docs/PARITY.md",
      "docs/ACCEPTANCE-FIRST-CYCLE.md",
      ".agents/",
      ".claude/",
      ".ai/tasks/"
    ]
  },
  "acceptance": [
    "SPEC-v0.1.md cobre autoridade, transicoes legais de estado, schema de task, schema de handoff, imutabilidade, estrategia de branch de coordenacao, invariantes de worktree e politica de Markdown derivado",
    "handoff.schema.json recusa handoff sem base_commit, delivery_commit, sequence e previous_handoff, e recusa strings vazias",
    "scripts/handoff.sh recusa task_id fora de ^AIC-[0-9]{4}$ e nao escreve fora de .ai/handoffs/",
    "criacao do handoff e atomica: duas execucoes simultaneas com a mesma sequencia resultam em exatamente um arquivo criado e uma falha",
    "o modelo suporta Claude -> Codex -> Claude com handoffs sequenciados e encadeados por previous_handoff",
    "tests/test_handoff.sh roda sem framework e falha se qualquer criterio acima quebrar",
    "nenhum arquivo em forbidden_paths e tocado"
  ],
  "handoffs": [
    "0001-claude.json",
    "0002-codex.json",
    "0003-claude.json",
    "0004-codex.json"
  ],
  "notes": "Aceita pelo coordenador em f01adf6 (re-revisao do Codex: ACEITAR_COM_RESSALVAS). Estados intermediarios nao foram gravados em JSON durante a rodada 1; o estado atual foi atualizado depois, sob autorizacao do coordenador. Ressalvas: 0003 cita 01730e8 no next_action (entregue: f01adf6); autoria dos commits antigos; lock morto exige rmdir."
}
